{
  "schema": 1,
  "packId": "simple-pack",
  "packName": "Simple Pack",
  "profileVersion": "1.0.0",
  "supportUrl": "",
  "homepageUrl": "",
  "expectedMinecraftVersions": ["1.21"],
  "expectedLoaders": ["fabric"],
  "minimumJavaMajor": 21,
  "minimumRamMb": 4096,
  "recommendedRamMb": 6144,
  "requiredMods": [
    {
      "id": "sodium",
      "name": "Sodium",
      "requiredVersion": "",
      "reason": "Required renderer."
    }
  ],
  "recommendedMods": [],
  "blockedMods": [],
  "allowedExtraMods": []
}
