{
  "schema": 1,
  "packId": "conflict-rules-pack",
  "packName": "Conflict Rules Pack",
  "profileVersion": "1.0.0",
  "supportUrl": "",
  "homepageUrl": "",
  "expectedMinecraftVersions": ["1.21"],
  "expectedLoaders": ["fabric"],
  "minimumJavaMajor": 21,
  "minimumRamMb": 4096,
  "recommendedRamMb": 6144,
  "requiredMods": [
    {
      "id": "sodium",
      "name": "Sodium",
      "requiredVersion": "",
      "reason": "Required renderer."
    },
    {
      "id": "iris",
      "name": "Iris Shaders",
      "requiredVersion": "",
      "reason": "Required for shader support."
    }
  ],
  "recommendedMods": [],
  "blockedMods": [
    {
      "id": "optifine",
      "name": "OptiFine",
      "requiredVersion": "",
      "reason": "Incompatible with Sodium and Iris."
    }
  ],
  "allowedExtraMods": [
    "journeymap",
    "xaeros-minimap"
  ]
}
